{
  "schema_version": "content-rule-set/2",
  "rule_set": {
    "id": "__REPLACE_ME__",
    "name": "__REPLACE_ME__",
    "status": "proposed",
    "owner": null,
    "decision_ref": null
  },
  "sources": [
    {
      "id": "__REPLACE_ME__",
      "path": "__REPLACE_ME__",
      "sha256": "0000000000000000000000000000000000000000000000000000000000000000"
    }
  ],
  "fact_definitions": [
    {
      "id": "__REPLACE_ME__",
      "description": "__REPLACE_ME__",
      "level": "instance",
      "type": "string",
      "allowed_values": [
        "__REPLACE_ME__"
      ],
      "accepted_sources": [
        {
          "basis": "observed",
          "provider": "__REPLACE_ME__"
        }
      ]
    }
  ],
  "rules": [],
  "conflict_groups": []
}
